<?xml version="1.0" encoding="ISO-8859-1"?>
<!DOCTYPE XServeConfig SYSTEM "./xserve_config.dtd">
<XServeConfig>
	<XFieldExtractor name="XMDA100 Multihop Config XML" order="3">
		<XFields>
			<XField name="amtype" byteoffset="2" length="1" type="uint8"/>
			<XField name="nodeid" byteoffset="7" length="2" type="uint16" specialtype="nodeid"/>
			<XField name="parent" byteoffset="14" length="2" type="uint16" specialtype="parentid"/>
			<XField name="group" byteoffset="3" length="1" type="uint8"/>
			<XField name="socketid" byteoffset="11" length="1" type="uint8"/>
			<XField name="board_id" byteoffset="12" length="1" type="uint8" specialtype="boardid"/>
			<XField name="packet_id" byteoffset="13" length="1" type="uint8"/>
			<XField name="voltage" byteoffset="16" length="2" type="uint16">
				<XConversion function="(1252352/x)" returntype="uint16">
					<XConvParam variablename="x" fieldname="voltage" type="float"/>
				</XConversion>
			</XField>
			<XField name="temp" byteoffset="18" length="2" type="uint16">
				<XConversion function="((1/(0.001307050 + 0.000214381 * log( 10000*(1023-x)/x) + 0.000000093 * (log( 10000*(1023-x)/x )^3))) - 273.15)" returntype="float">
					<XConvParam variablename="x" fieldname="temp" type="uint16"/>					
				</XConversion>			
			</XField>
			<XField name="light" byteoffset="20" length="2" type="uint16">
				<XConversion function="(y * (1252352/x) / 1023)" returntype="uint16">
					<XConvParam variablename="x" fieldname="voltage" type="float"/>
					<XConvParam variablename="y" fieldname="light" type="uint16"/>
				</XConversion>
			</XField>
			<XField name="adc2" byteoffset="22" length="2" type="uint16">
				<XConversion function="(x * (1252352/y) / 1023)" returntype="uint16">
					<XConvParam variablename="x" fieldname="adc2" type="uint16"/>
					<XConvParam variablename="y" fieldname="voltage" type="float"/>
				</XConversion>
			</XField>
			<XField name="adc3" byteoffset="24" length="2" type="uint16">
				<XConversion function="(x * (1252352/y) / 1023)" returntype="uint16">
					<XConvParam variablename="x" fieldname="adc3" type="uint16"/>
					<XConvParam variablename="y" fieldname="voltage" type="float"/>
				</XConversion>
			</XField>
			<XField name="adc4" byteoffset="26" length="2" type="uint16">
				<XConversion function="(x * (1252352/y) / 1023)" returntype="uint16">
					<XConvParam variablename="x" fieldname="adc4" type="uint16"/>
					<XConvParam variablename="y" fieldname="voltage" type="float"/>
				</XConversion>
			</XField>
			<XField name="adc5" byteoffset="28" length="2" type="uint16">
				<XConversion function="(x * (1252352/y) / 1023)" returntype="uint16">
					<XConvParam variablename="x" fieldname="adc5" type="uint16"/>
					<XConvParam variablename="y" fieldname="voltage" type="float"/>
				</XConversion>
			</XField>
			<XField name="adc6" byteoffset="30" length="2" type="uint16">
				<XConversion function="(x * (1252352/y) / 1023)" returntype="uint16">
					<XConvParam variablename="x" fieldname="adc6" type="uint16"/>
					<XConvParam variablename="y" fieldname="voltage" type="float"/>
				</XConversion>
			</XField>
		</XFields>
		<XFilter>
			<XCondAnd>
			
				<!--
					Check if this is a sensor type packet...AMTYPE_MULTIHOP or AMTYPE_XDEBUG
					The Byte offsets defined above assume that there is a multihop header
				/-->
				<XCondOr>
					<XCond name="IsEqual">
						<XFilterParam name="fieldname" value="amtype"/>
						<XFilterParam name="fieldvalue" value="0x31"/>
					</XCond>
					<XCond name="IsEqual">
						<XFilterParam name="fieldname" value="amtype"/>
						<XFilterParam name="fieldvalue" value="0x33"/>
					</XCond>
					<XCondAnd>
						<XCondOr>
							<XCond name="IsEqual">
								<XFilterParam name="fieldname" value="socketid"/>
								<XFilterParam name="fieldvalue" value="0x31"/>
							</XCond>
							<XCond name="IsEqual">
								<XFilterParam name="fieldname" value="socketid"/>
								<XFilterParam name="fieldvalue" value="0x33"/>
							</XCond>
						</XCondOr>
						<XCondOr>
							<XCond name="IsEqual">
								<XFilterParam name="fieldname" value="amtype"/>
								<XFilterParam name="fieldvalue" value="0x0B"/>
							</XCond>
							<XCond name="IsEqual">
								<XFilterParam name="fieldname" value="amtype"/>
								<XFilterParam name="fieldvalue" value="0x0D"/>
							</XCond>
						</XCondOr>
					
					</XCondAnd>
				</XCondOr>
				<XCond name="IsEqual">
					<XFilterParam name="fieldname" value="board_id"/>
					<XFilterParam name="fieldvalue" value="0x91"/>
				</XCond>				
			</XCondAnd>
		</XFilter>
		<XDataSinks>
			<XDataSink name="Generic Print Datasink">
				<XDSParam name="printstring" value="MDA100 [sensor data converted to engineering units]:\n   health: node id	= %s	battery:  = %s mv \n	temperature:	= %s degC \n	light:		= %s mv \n	adc chan 2:	= %s mv \n	adc chan 3:	= %s mv	\n	adc chan 4:	= %s mv \n	adc chan 5:	= %s mv	\n	adc chan 6:	= %s mv"/>
				<XDSParam name="printfields" value="nodeid,voltage,temp,light,adc2,adc3,adc4,adc5,adc6"/>
			</XDataSink>
			<XDataSink name="Generic Alert Datasink">
				<XDSParam name="voltage" value="[2500,3500]"/>
				<XDSParam name="temp" value="[-5,45]"/>
				<XDSParam name="light" value="[0,3000]"/>
				<XDSParam name="adc2" value="[0,3200]"/>
				<XDSParam name="adc3" value="[0,3200]"/>
				<XDSParam name="adc4" value="[0,3200]"/>
				<XDSParam name="adc5" value="[0,3200]"/>
				<XDSParam name="adc6" value="[0,3200]"/>
			</XDataSink>
			<XDataSink name="Open Log Datasink">
				<XDSParam name="tablename_1" value="xbw_da100_results"/>
				<XDSParam name="createsql_1" value="CREATE TABLE xbw_da100_results ( result_time timestamp without time zone,epoch integer, nodeid integer, parent integer,voltage integer, temp integer, light integer, adc2 integer,adc3 integer, adc4 integer, adc5 integer, adc6 integer )"/>				
				<XDSParam name="tablename_2" value="xbw_da100_results_l"/>				
				<XDSParam name="createsql_2" value="CREATE TABLE xbw_da100_results_l ( result_time timestamp without time zone,epoch integer, nodeid integer, parent integer,voltage integer, temp integer, light integer, adc2 integer,adc3 integer, adc4 integer, adc5 integer, adc6 integer )"/>
				<XDSParam name="rulesql_2" value="CREATE RULE cache_xbw_da100_results AS ON INSERT TO xbw_da100_results DO ( DELETE FROM xbw_da100_results_l WHERE nodeid = NEW.nodeid;INSERT INTO xbw_da100_results_l VALUES (NEW.*); )"/>				
				<XDSParam name="insertsql_2" value="INSERT into xbw_da100_results (result_time,nodeid,parent,voltage,temp,light,adc2,adc3,adc4,adc5,adc6) values (now(),%i,%i,%i,%i,%i,%i,%i,%i,%i,%i)"/>
				<XDSParam name="insertfields_2" value="nodeid,parent,voltage,temp,light,adc2,adc3,adc4,adc5,adc6"/>
			</XDataSink>
		</XDataSinks>
	</XFieldExtractor>

</XServeConfig>