<?xml version="1.0" encoding="ISO-8859-1"?>
<!DOCTYPE XServeConfig SYSTEM "./xserve_config.dtd">
<XServeConfig>
	<XFieldExtractor name="XMTS310 Multihop Config XML" order="3">
		<XFields>
			<XField name="amtype" byteoffset="2" length="1" type="uint8"/>
			<XField name="nodeid" byteoffset="7" length="2" type="uint16" specialtype="nodeid"/>
			<XField name="parent" byteoffset="14" length="2" type="uint16" specialtype="parentid"/>
			<XField name="group" byteoffset="3" length="1" type="uint8"/>
			<XField name="socketid" byteoffset="11" length="1" type="uint8"/>
			<XField name="board_id" byteoffset="12" length="1" type="uint8" specialtype="boardid"/>
			<XField name="packet_id" byteoffset="13" length="1" type="uint8"/>
			<XField name="voltage" byteoffset="16" length="2" type="uint16">
				<XConversion function="(1252352/x)" returntype="uint16">
					<XConvParam variablename="x" fieldname="voltage" type="float"/>
				</XConversion>
			</XField>
			<XField name="temp" byteoffset="18" length="2" type="uint16">
				<XConversion function="((1/(.001307050 + 0.000214381 * log( (10000 * (1023-x))/x   ) + 0.000000093 * (log( (10000 * (1023-x))/x )^3))) - 273.15)" returntype="float">
					<XConvParam variablename="x" fieldname="temp" type="uint16"/>					
				</XConversion>			
			</XField>
			<XField name="light" byteoffset="20" length="2" type="uint16">
				<XConversion function="(y * (1252352/x) / 1023)" returntype="uint16">
					<XConvParam variablename="x" fieldname="voltage" type="float"/>
					<XConvParam variablename="y" fieldname="light" type="uint16"/>
				</XConversion>
			</XField>
			<XField name="mic" byteoffset="22" length="2" type="uint16"/>
			<XField name="accel_x" byteoffset="24" length="2" type="uint16">
				<XConversion function="1000.0 * (1.0 - (500 - x)/((500 - 400)/2))" returntype="float">
					<XConvParam variablename="x" fieldname="accel_x" type="uint16"/>					
				</XConversion>

			</XField>
			<XField name="accel_y" byteoffset="26" length="2" type="uint16">
				<XConversion function="1000.0 * (1.0 - (500 - x)/((500 - 400)/2))" returntype="float">
					<XConvParam variablename="x" fieldname="accel_y" type="uint16"/>					
				</XConversion>
			</XField>
			<XField name="mag_x" byteoffset="28" length="2" type="uint16">
				<XConversion function="x / (1.023*2.262*3.2)" returntype="float">
					<XConvParam variablename="x" fieldname="mag_x" type="uint16"/>					
				</XConversion>
			</XField>
			<XField name="mag_y" byteoffset="30" length="2" type="uint16">			
				<XConversion function="x / (1.023*2.262*3.2)" returntype="float">
					<XConvParam variablename="x" fieldname="mag_y" type="uint16"/>					
				</XConversion>
			</XField>
		</XFields>
		<XFilter>
			<XCondAnd>
			
				<!--
					Check if this is a sensor type packet...AMTYPE_MULTIHOP or AMTYPE_XDEBUG
					The Byte offsets defined above assume that there is a multihop header
				/-->
				<XCondOr>
					<XCond name="IsEqual">
						<XFilterParam name="fieldname" value="amtype"/>
						<XFilterParam name="fieldvalue" value="0x31"/>
					</XCond>
					<XCond name="IsEqual">
						<XFilterParam name="fieldname" value="amtype"/>
						<XFilterParam name="fieldvalue" value="0x33"/>
					</XCond>
					<XCondAnd>
						<XCondOr>
							<XCond name="IsEqual">
								<XFilterParam name="fieldname" value="socketid"/>
								<XFilterParam name="fieldvalue" value="0x31"/>
							</XCond>
							<XCond name="IsEqual">
								<XFilterParam name="fieldname" value="socketid"/>
								<XFilterParam name="fieldvalue" value="0x33"/>
							</XCond>
						</XCondOr>
						<XCondOr>
							<XCond name="IsEqual">
								<XFilterParam name="fieldname" value="amtype"/>
								<XFilterParam name="fieldvalue" value="0x0B"/>
							</XCond>
							<XCond name="IsEqual">
								<XFilterParam name="fieldname" value="amtype"/>
								<XFilterParam name="fieldvalue" value="0x0D"/>
							</XCond>
						</XCondOr>										
					</XCondAnd>
				</XCondOr>
				<XCond name="IsEqual">
					<XFilterParam name="fieldname" value="board_id"/>
					<XFilterParam name="fieldvalue" value="0x84"/>
				</XCond>				
			</XCondAnd>
		</XFilter>
		<XDataSinks>
			<XDataSink name="Generic Print Datasink">
				<XDSParam name="printstring" value="MTS310 [sensor data converted to engineering units]:\n   health:     node id=%s parent=%s\n   battery:  = %s mv \n   temperature=%s degC\n   light: = %s ADC mv\n   mic: = %s ADC counts\n   AccelX: = %s milliG, AccelY: = %s milliG\n   MagX: = %s mgauss, MagY: =%s mgauss "/>
				<XDSParam name="printfields" value="nodeid,parent,voltage,temp,light,mic,accel_x,accel_y,mag_x,mag_y"/>
			</XDataSink>
			<XDataSink name="Open Log Datasink">
				<XDSParam name="tablename_1" value="mts310_results"/>
				<XDSParam name="createsql_1" value="CREATE TABLE mts310_results ( result_time timestamp without time zone, epoch integer, nodeid integer, parent integer, voltage integer, temp integer, light integer, accel_x integer, accel_y integer, mag_x integer, mag_y integer, mic integer)"/>	
				<XDSParam name="tablename_2" value="mts310_results_l"/>				
				<XDSParam name="createsql_2" value="CREATE TABLE mts310_results_l ( result_time timestamp without time zone, epoch integer, nodeid integer, parent integer, voltage integer, temp integer, light integer, accel_x integer, accel_y integer, mag_x integer, mag_y integer, mic integer)"/>	
				<XDSParam name="rulesql_2" value="CREATE RULE cache_mts310_results AS ON INSERT TO mts310_results DO ( DELETE FROM mts310_results_l WHERE nodeid = NEW.nodeid;INSERT INTO mts310_results_l VALUES (NEW.*); )"/>				
				<XDSParam name="insertsql_2" value="INSERT into mts310_results (result_time,nodeid,parent,voltage,temp,light,accel_x,accel_y,mag_x,mag_y,mic) values (now(),%i,%i,%i,%i,%i,%i,%i,%i,%i,%i)"/>
				<XDSParam name="insertfields_2" value="nodeid,parent,voltage,temp,light,accel_x,accel_y,mag_x,mag_y,mic"/>
			</XDataSink>
			<XDataSink name="Generic Alert Datasink">
				<XDSParam name="voltage" value="[2500,3500]"/>
				<XDSParam name="temp" value="[-5,45]"/>
				<XDSParam name="light" value="[0,3000]"/>
				<XDSParam name="mic" value="[0,800]"/>
				<XDSParam name="accel_x" value="[-2000,2000]"/>
				<XDSParam name="accel_y" value="[-2000,2000]"/>
				<XDSParam name="mag_x" value="[0,100]"/>
				<XDSParam name="mag_y" value="[0,100]"/>
			</XDataSink>
			<XDataSink name="Generic Modbus Datasink">
				<XDSParam name="Mapping1" value="1,voltage,0"/>
				<XDSParam name="Mapping2" value="2,temp,0"/>	
				<XDSParam name="Mapping3" value="3,light,0"/>	
				<XDSParam name="Mapping4" value="4,accel_x,0"/>	
				<XDSParam name="Mapping5" value="5,accel_y,0"/>	
				<XDSParam name="Mapping6" value="6,mag_x,0"/>	
				<XDSParam name="Mapping7" value="7,mag_y,0"/>					
				<XDSParam name="Mapping8" value="8,mic,0"/>
				<XDSParam name="Mapping9" value="9,voltage,1"/>
				<XDSParam name="Mapping10" value="10,temp,1"/>	
				<XDSParam name="Mapping11" value="11,light,1"/>	
				<XDSParam name="Mapping12" value="12,accel_x,1"/>	
				<XDSParam name="Mapping13" value="13,accel_y,1"/>	
				<XDSParam name="Mapping14" value="14,mag_x,1"/>	
				<XDSParam name="Mapping15" value="15,mag_y,1"/>	
				<XDSParam name="Mapping16" value="16,mic,1"/>																				
			</XDataSink>				
		</XDataSinks>
	</XFieldExtractor>
	
</XServeConfig>