<?xml version="1.0" encoding="ISO-8859-1"?>
<!DOCTYPE XServeConfig SYSTEM "./xserve_config.dtd">
<XServeConfig>
	<XFieldExtractor name="XMDA500 Sensor Config XML" order="3">
		<XFields>
			<XField name="amtype" byteoffset="2" length="1" type="uint8"/>
			<XField name="nodeid" byteoffset="7" length="2" type="uint16" specialtype="nodeid"/>
			<!--
			<XField name="parent" byteoffset="14" length="2" type="uint16" specialtype="parentid"/>
			/-->
			<XField name="group" byteoffset="3" length="1" type="uint8"/>
			<XField name="board_id" byteoffset="5" length="1" type="uint8" specialtype="boardid"/>
			<XField name="packet_id" byteoffset="6" length="1" type="uint8"/>
			<XField name="voltage" byteoffset="9" length="2" type="uint16">
				<XConversion function="(1251100/x)" returntype="uint16">
					<XConvParam variablename="x" fieldname="voltage" type="float"/>
				</XConversion>
			</XField>
			<XField name="tempR" byteoffset="11" length="2" type="uint16">
				<XConversion function="(10000*x / (1023-x))" returntype="uint16">
					<XConvParam variablename="x" fieldname="tempR" type="uint16"/>					
				</XConversion>			
			</XField>
			<XField name="temp" byteoffset="13" length="2" type="uint16">
				<XConversion function="((1/(.001307050 + 0.000214381 * log( (10000 *x/ (1023-x))   ) + 0.000000093 * (log( (10000 *x/ (1023-x)) )^3))) - 273.15)" returntype="float">
					<XConvParam variablename="x" fieldname="temp" type="uint16"/>					
				</XConversion>			
			</XField>
			<XField name="adc2" byteoffset="15" length="2" type="uint16">
				<XConversion function="(x*1251100/(1023*y))" returntype="uint16">
					<XConvParam variablename="x" fieldname="adc2" type="float"/>					
					<XConvParam variablename="y" fieldname="voltage" type="float"/>				
				</XConversion>			
			</XField>
			<XField name="adc3" byteoffset="17" length="2" type="uint16">
				<XConversion function="(x*1251100/(1023*y))" returntype="uint16">
					<XConvParam variablename="x" fieldname="adc3" type="float"/>					
					<XConvParam variablename="y" fieldname="voltage" type="float"/>				
				</XConversion>			
			</XField>
			<XField name="adc4" byteoffset="19" length="2" type="uint16">
				<XConversion function="(x*1251100/(1023*y))" returntype="uint16">
					<XConvParam variablename="x" fieldname="adc4" type="float"/>					
					<XConvParam variablename="y" fieldname="voltage" type="float"/>				
				</XConversion>			
			</XField>
			<XField name="adc5" byteoffset="21" length="2" type="uint16">
				<XConversion function="(x*1251100/(1023*y))" returntype="uint16">
					<XConvParam variablename="x" fieldname="adc5" type="float"/>					
					<XConvParam variablename="y" fieldname="voltage" type="float"/>				
				</XConversion>			
			</XField>
			<XField name="adc6" byteoffset="23" length="2" type="uint16">
				<XConversion function="(x*1251100/(1023*y))" returntype="uint16">
					<XConvParam variablename="x" fieldname="adc6" type="float"/>					
					<XConvParam variablename="y" fieldname="voltage" type="float"/>				
				</XConversion>			
			</XField>
			<XField name="adc7" byteoffset="25" length="2" type="uint16">
				<XConversion function="(x*1251100/(1023*y))" returntype="uint16">
					<XConvParam variablename="x" fieldname="adc7" type="float"/>					
					<XConvParam variablename="y" fieldname="voltage" type="float"/>				
				</XConversion>			
			</XField>
		</XFields>
		<XFilter>
			<XCondAnd>
			
				<!--
					Check if this is a sensor type packet...AMTYPE_MULTIHOP or AMTYPE_XDEBUG
					The Byte offsets defined above assume that there is a multihop header
				/-->
				<XCondOr>
					<XCond name="IsEqual">
						<XFilterParam name="fieldname" value="amtype"/>
						<XFilterParam name="fieldvalue" value="0x00"/>
					</XCond>

					<XCond name="IsEqual">
						<XFilterParam name="fieldname" value="amtype"/>
						<XFilterParam name="fieldvalue" value="0x32"/>
					</XCond>

				</XCondOr>
				<XCond name="IsEqual">
					<XFilterParam name="fieldname" value="board_id"/>
					<XFilterParam name="fieldvalue" value="0x01"/>
				</XCond>				
			</XCondAnd>
		</XFilter>
		<XDataSinks>
			<XDataSink name="Generic Print Datasink">
				<XDSParam name="printstring" value="MDA500 [sensor data converted to engineering units]:\n   health:     node id=%s\n   battery:    volts=%s mv\n   thermistor: resistance=%s ohms, tempurature=%s C\n   adc chan 2: voltage=%s mv\n   adc chan 3: voltage=%s mv\n   adc chan 4: voltage=%s mv\n   adc chan 5: voltage=%s mv\n   adc chan 6: voltage=%s mv\n   adc chan 7: voltage=%s mv "/>
				<XDSParam name="printfields" value="nodeid,voltage,tempR,temp,adc2,adc3,adc4,adc5,adc6,adc7"/>
			</XDataSink>
			<XDataSink name="Open Log Datasink">
				<XDSParam name="tablename_1" value="mda500_results"/>
				<XDSParam name="createsql_1" value="CREATE TABLE mda500_results ( result_time timestamp without time zone,epoch integer, nodeid integer, parent integer,voltage integer, temp integer, adc2 integer,adc3 integer, adc4 integer, adc5 integer, adc6 integer, adc7 integer)"/>				
				<XDSParam name="tablename_2" value="mda500_results_l"/>				
				<XDSParam name="createsql_2" value="CREATE TABLE mda500_results_l ( result_time timestamp without time zone,epoch integer, nodeid integer, parent integer,voltage integer, temp integer, adc2 integer,adc3 integer, adc4 integer, adc5 integer, adc6 integer, adc7 integer)"/>
				<XDSParam name="rulesql_2" value="CREATE RULE cache_mda500_results AS ON INSERT TO mda500_results DO ( DELETE FROM mda500_results_l WHERE nodeid = NEW.nodeid;INSERT INTO mda500_results_l VALUES (NEW.*); )"/>				
				<XDSParam name="insertsql_2" value="INSERT into mda500_results (result_time,nodeid,voltage,temp,adc2,adc3,adc4,adc5,adc6,adc7)values (now(),%i,%i,%i,%i,%i,%i,%i,%i,%i)"/>
				<XDSParam name="insertfields_2" value="nodeid,voltage,temp,adc2,adc3,adc4,adc5,adc6,adc7"/>
			</XDataSink>
			<XDataSink name="Generic Alert Datasink">
				<XDSParam name="voltage" value="[2500,3500]"/>
				<XDSParam name="temp" value="[-5,45]"/>
				<XDSParam name="adc2" value="[0,3200]"/>
				<XDSParam name="adc3" value="[0,3200]"/>
				<XDSParam name="adc4" value="[0,3200]"/>
				<XDSParam name="adc5" value="[0,3200]"/>
				<XDSParam name="adc6" value="[0,3200]"/>
				<XDSParam name="adc7" value="[0,3200]"/>
			</XDataSink>
		</XDataSinks>
	</XFieldExtractor>

</XServeConfig>