<?xml version="1.0" encoding="ISO-8859-1"?>
<!-- This class is automatically generated by mig. DO NOT EDIT THIS FILE. -->
<!-- $Id: mts410_mesh_config_debug.xml,v 1.1.2.1 2007/02/02 02:25:01 nxu Exp $ -->
<!DOCTYPE XServeConfig SYSTEM "./xserve_config.dtd">
<XServeConfig>
<XFieldExtractor name="XDataMsg XServe Config XML" order="1">
  <XFields>

	<XField name="addr" byteoffset="0" length="2" type="uint16"/>
	<XField name="amtype" byteoffset="2" length="1" type="uint8"/>
	<XField name="groupid" byteoffset="3" length="1" type="uint8"/>
	<XField name="length" byteoffset="4" length="1" type="uint8"/>
	<XField name="sourceaddr" byteoffset="5" length="2" type="uint16"/>
	<XField name="nodeid" byteoffset="7" length="2" type="uint16" specialtype="nodeid"/>
	<XField name="seqno" byteoffset="9" length="2" type="short"/>
	<XField name="socket" byteoffset="11" length="1" type="uint8"/>
	<XField name="board_id" byteoffset="12" length="1" type="uint8" specialtype="boardid"/>
	<XField name="packet_id" byteoffset="13" length="1" type="uint8"/>
	<XField name="parent" byteoffset="14" length="2" type="uint16" specialtype="parentid"/>
	<XField name="seq_no" byteoffset="16" length="2" type="uint16"/>
	<XField name="vref" byteoffset="18" length="2" type="uint16"/>
	<XField name="pir" byteoffset="20" length="1" type="uint8"/>
	<XField name="pir_sum" byteoffset="21" length="1" type="uint8"/>
	<XField name="humidity" byteoffset="22" length="2" type="uint16"/>
	<XField name="temperature" byteoffset="24" length="2" type="uint16"/>
	<XField name="cal_wrod1" byteoffset="26" length="2" type="uint16"/>
	<XField name="cal_wrod2" byteoffset="28" length="2" type="uint16"/>
	<XField name="cal_wrod3" byteoffset="30" length="2" type="uint16"/>
	<XField name="cal_wrod4" byteoffset="32" length="2" type="uint16"/>
	<XField name="intersematemp" byteoffset="34" length="2" type="uint16"/>
	<XField name="pressure" byteoffset="36" length="2" type="uint16"/>
	<XField name="accelx" byteoffset="38" length="2" type="uint16"/>
	<XField name="accely" byteoffset="40" length="2" type="uint16"/>
	<XField name="taoch0" byteoffset="42" length="2" type="uint16"/>
	<XField name="taoch1" byteoffset="44" length="2" type="uint16"/>
	<XField name="audio" byteoffset="46" length="2" type="uint16"/>
	<XField name="adc5" byteoffset="48" length="2" type="uint16"/>
	<XField name="adc6" byteoffset="50" length="2" type="uint16"/>
	<XField name="pir_max" byteoffset="52" length="2" type="uint16"/>
	<XField name="pir_bias" byteoffset="16" length="2" type="uint16"/>
	<XField name="pir_threshold" byteoffset="18" length="2" type="uint16"/>
	<XField name="pir_N" byteoffset="20" length="2" type="uint16"/>
	<XField name="pir_T" byteoffset="22" length="2" type="uint16"/>
  </XFields>
  <XFilter>  <XCond name="alwaysTrue"/>  </XFilter>
<XDataSinks>
   <XDataSink name="Generic Print Datasink">
		<XDSParam name="printstring" 
				   value="XDataMsg:\n
      addr = 	%s\n
      amtype = 	%s\n
      groupid = 	%s\n
      length = 	%s\n
      sourceaddr = 	%s\n
      nodeid = 	%s\n
      seqno = 	%s\n
      socket = 	%s\n
      board_id = 	%s\n
      packet_id = 	%s\n
      parent = 	%s\n
      seq_no = 	%s\n
      vref = 	%s\n
      pir = 	%s\n
      pir_sum = 	%s\n
      humidity = 	%s\n
      temperature = 	%s\n
      cal_wrod1 = 	%s\n
      cal_wrod2 = 	%s\n
      cal_wrod3 = 	%s\n
      cal_wrod4 = 	%s\n
      intersematemp = 	%s\n
      pressure = 	%s\n
      accelx = 	%s\n
      accely = 	%s\n
      taoch0 = 	%s\n
      taoch1 = 	%s\n
      audio = 	%s\n
      adc5 = 	%s\n
      adc6 = 	%s\n
      pir_max = 	%s\n
      pir_bias = 	%s\n
      pir_threshold = 	%s\n
      pir_N = 	%s\n
      pir_T = 	%s\n
"/>
		<XDSParam name="printfields" value="addr,amtype,groupid,length,sourceaddr,nodeid,seqno,socket,board_id,packet_id,parent,seq_no,vref,pir,pir_sum,humidity,temperature,cal_wrod1,cal_wrod2,cal_wrod3,cal_wrod4,intersematemp,pressure,accelx,accely,taoch0,taoch1,audio,adc5,adc6,pir_max,pir_bias,pir_threshold,pir_N,pir_T"/>
   </XDataSink>
   <XDataSink name="Generic File Datasink">                      
     <XDSParam name="rawfilename" value="XDataMsg_raw.txt"/>
     <XDSParam name="parsedfilename" value="XDataMsg_parsed.txt"/>
     <XDSParam name="convertedfilename" value="XDataMsg_converted.txt"/>        
     <XDSParam name="delim" value=","/>
     <XDSParam name="header" value="yes"/>
     <XDSParam name="timestamp" value="%m-%d-%Y %H:%M:%S"/>
     <XDSParam name="backup" value="yes"/>
   </XDataSink>
	<XDataSink name="Open Log Datasink">
		<XDSParam name="tablename_1" value="mts410_results"/>
		<XDSParam name="createsql_1" value=
		   "DELETE FROM task_query_log where query_id=162;
			INSERT INTO task_query_log (query_id, table_name, query_type) VALUES (162, 'mts410_results', 'MOTEVIEW_1_0');
			CREATE TABLE mts410_results ( result_time timestamp without time zone, nodeid integer,parent integer,vref integer,pir integer,pir_sum integer,pir_max integer,humidity integer,temperature integer); 
		CREATE INDEX XDataMsg_time_idx ON mts410_results USING BTREE ( result_time ) ;
		CREATE INDEX XDataMsg_nodeid_idx ON mts410_results USING BTREE ( nodeid ) ;"/>	
		<XDSParam name="tablename_2" value="mts410_results_l"/>				
		<XDSParam name="createsql_2" value="CREATE TABLE mts410_results_l ( result_time timestamp without time zone, nodeid integer,parent integer,vref integer,pir integer,pir_sum integer,pir_max integer,humidity integer,temperature integer)"/>
		<XDSParam name="rulesql_2" value="CREATE RULE XDataMsg_cache_results AS ON INSERT TO mts410_results DO ( DELETE FROM mts410_results_l WHERE nodeid = NEW.nodeid;INSERT INTO mts410_results_l VALUES (NEW.*); )"/>				
		<XDSParam name="insertsql_2" value="INSERT into mts410_results (result_time , nodeid ,parent ,vref ,pir ,pir_sum ,pir_max ,humidity ,temperature ) values (now(),%i,%i,%i,%i,%i,%i,%i,%i)"/>
		<XDSParam name="insertfields_2" value="nodeid,parent,vref,pir,pir_sum,pir_max,humidity,temperature"/>
	</XDataSink>
</XDataSinks>
</XFieldExtractor>
</XServeConfig>
<!-- This class is automatically generated by mig. DO NOT EDIT THIS FILE. -->

