<?xml version="1.0" encoding="ISO-8859-1"?>
<!DOCTYPE XServeConfig SYSTEM "./xserve_config.dtd">
<XServeConfig>
	<XFieldExtractor name="XMEP510 XSENSOR Config XML" order="3">
		<XFields>
			<XField name="amtype" byteoffset="2" length="1" type="uint8"/>
			<XField name="nodeid" byteoffset="7" length="2" type="uint16" specialtype="nodeid"/>
			<!--
			<XField name="parent" byteoffset="14" length="2" type="uint16" specialtype="parentid"/>
			/-->
			<XField name="group" byteoffset="3" length="1" type="uint8"/>
			<XField name="board_id" byteoffset="5" length="1" type="uint8" specialtype="boardid"/>
			<XField name="packet_id" byteoffset="6" length="1" type="uint8"/>
			<XField name="seqno" byteoffset="8" length="2" type="uint16"/>
			<XField name="voltval" byteoffset="9" length="2" type="uint16">
				<XConversion function="(1251100/x)" returntype="uint16">
					<XConvParam variablename="x" fieldname="voltval" type="float"/>
				</XConversion>
			</XField>
			<XUnionField name="voltage" type="uint16" optor="lshift" leftname="voltval" rightname="0"/>

			<XField name="tempR" byteoffset="11" length="2" type="uint16">
				<XConversion function="(10000*x / (1023-x))" returntype="uint16">
					<XConvParam variablename="x" fieldname="tempR" type="float"/>					
				</XConversion>			
			</XField>
			<XField name="thermister" byteoffset="11" length="2" type="uint16">
				<XConversion function="((1/(.001307050 + 0.000214381 * log( (10000 *x/ (1023-x))   ) + 0.000000093 * (log( (10000 *x/ (1023-x)) )^3))) - 273.15)" returntype="float">
					<XConvParam variablename="x" fieldname="thermister" type="float"/>					
				</XConversion>			
			</XField>
			<XField name="humidity" byteoffset="13" length="2" type="uint16">
				<XConversion function="(-38.4 + 0.0098*y - 25.0)*(0.01 + 0.00008 * x) - 4.0 + 0.0405 * x - 0.0000028 * x * x" returntype="float">
					<XConvParam variablename="x" fieldname="humidity" type="float"/>					
					<XConvParam variablename="y" fieldname="temp_hum" type="float"/>				
				</XConversion>			
			</XField>
			<XField name="temp_hum" byteoffset="15" length="2" type="uint16">
				<XConversion function="(-38.4 + 0.0098*x)" returntype="float">
					<XConvParam variablename="x" fieldname="temp_hum" type="float"/>					
				</XConversion>			
			</XField>
		</XFields>
		<XFilter>
			<XCondAnd>
			
				<!--
					Check if this is a sensor type packet...AMTYPE_MULTIHOP or AMTYPE_XDEBUG
					The Byte offsets defined above assume that there is a multihop header
				/-->
				<XCondOr>
					<XCond name="IsEqual">
						<XFilterParam name="fieldname" value="amtype"/>
						<XFilterParam name="fieldvalue" value="0x00"/>
					</XCond>

					<XCond name="IsEqual">
						<XFilterParam name="fieldname" value="amtype"/>
						<XFilterParam name="fieldvalue" value="0x32"/>
					</XCond>
				</XCondOr>
				<XCond name="IsEqual">
					<XFilterParam name="fieldname" value="board_id"/>
					<XFilterParam name="fieldvalue" value="0x04"/>
				</XCond>				
			</XCondAnd>
		</XFilter>
		<XDataSinks>
			<XDataSink name="Generic Print Datasink">
				<XDSParam name="printstring" value="MEP510 [sensor data converted to engineering units]:\n   health:     node id=%s \n   battery: =%s mv \n   thermistor: resistance=%s ohms, tempurature=%s C\n   temperature: =%s degC \n   humidity: =%s%%"/>
				<XDSParam name="printfields" value="nodeid,voltval,tempR,thermister,temp_hum,humidity"/>
			</XDataSink>
			<XDataSink name="Open Log Datasink">
				<XDSParam name="tablename_1" value="mep_results"/>
				<XDSParam name="createsql_1" value="CREATE TABLE mep_results ( result_time timestamp without time zone,epoch integer,nodeid integer,parent integer,voltage integer,thermister integer,humidity integer,temp_hum integer,inthum integer,inttemp integer,par_bottom integer,tsr_bottom integer,par_top integer,tsr_top integer,temp_pr integer,pressure integer,board_id integer)"/>				
				<XDSParam name="tablename_2" value="mep_results_l"/>				
				<XDSParam name="createsql_2" value="CREATE TABLE mep_results_l ( result_time timestamp without time zone,epoch integer,nodeid integer,parent integer,voltage integer,thermister integer,humidity integer,temp_hum integer,inthum integer,inttemp integer,par_bottom integer,tsr_bottom integer,par_top integer,tsr_top integer,temp_pr integer,pressure integer,board_id integer)"/>
				<XDSParam name="rulesql_2" value="CREATE RULE cache_mep_results AS ON INSERT TO mep_results DO ( DELETE FROM mep_results_l WHERE nodeid = NEW.nodeid;INSERT INTO mep_results_l VALUES (NEW.*); )"/>				
				<XDSParam name="insertsql_2" value="INSERT into mep_results (result_time,nodeid,epoch,voltage,thermister,humidity,temp_hum,board_id) values (now(),%i,%i,%i,%i,%i,%i,%i)"/>
				<XDSParam name="insertfields_2" value="nodeid,seqno,voltage,thermister,humidity,temp_hum,board_id"/>
			</XDataSink>
			<XDataSink name="Generic Alert Datasink">
				<XDSParam name="voltval" value="[2500,3500]"/>
				<XDSParam name="thermister" value="[-5,45]"/>
				<XDSParam name="humidity" value="[0,100]"/>
				<XDSParam name="temp_hum" value="[-5,45]"/>
			</XDataSink>
		</XDataSinks>
	</XFieldExtractor>

</XServeConfig>